{
  "id": "VC-01-11",
  "titulo": "Legislações citadas na seção 01 estão nas referências",
  "dominio": "validacao_cruzada",
  "criticidade": "OBRIG",
  "tipo": "lista",
  "secoes_relacionadas": [
    "identificacao_curso",
    "referencias_normativas"
  ],
  "condicionais_relacionadas": [],
  "pergunta": "O PPC mantém coerência transversal suficiente entre as seções 01 e 11 quanto a: Legislações citadas na seção 01 estão nas referências?",
  "rubrica": "Avaliar a consistência entre os trechos relacionados do PPC, usando evidências textuais e o contexto estrutural apenas como apoio. Não decidir por regra automática; fechar por revisão argumentada.",
  "boa_evidencia": "Trechos das seções relacionadas apresentam informação compatível, rastreável e suficiente para sustentar a coerência transversal.",
  "ma_evidencia": "As seções relacionadas entram em contradição, omitem uma parte necessária da relação ou não fornecem evidência suficiente para fechar a coerência.",
  "evidencia_minima": 2,
  "estados_permitidos": [
    "ATENDE",
    "NAO_ATENDE",
    "INCONCLUSIVO",
    "NAO_APLICAVEL"
  ]
}
